117,Brand New Instruments and Parts Company
186,Brand New Fashionable Department Stores
188,Brand New Bicycle Merchandise Warehouse
193,Brand New Practical Bike Supply Company
285,Brand New Bike Products and Accessories
221,Brand New Professional Containers and Packaging Co.
135,Brand New Security Racks and Locks Wholesalers
83,Brand New Beneficial Exercises and Activities
229,Brand New Maintenance and Repair for Bicycles
112,Brand New Self-Contained Cycle Parts Company
116,Brand New Kickstands and Accessories Company
274,Brand New Chain and Chain Tool Distributions
298,Brand New Helpful Sales and Repair Service 
127,Brand New Authorized Bike Sales and Rental
111,Brand New Outdoor Aerobic Systems Company
118,Brand New Neighborhood Bicycle Storehouse
62,Brand New Sure & Reliable Sporting Goods
70,Brand New Mechanical Brake Manufacturers
318,Brand New Technical Parts Manufacturing
85,Brand New Commerce Bicycle Specialists
122,Brand New Go-cart and Bike Specialists
200,Brand New Guaranteed Sales and Service
239,Brand New Downhill Bicycle Specialists
253,Brand New Sparkling Paint and Finishes
306,Brand New Convenient Sales and Service
54,Brand New Paints and Solvents Company
97,Brand New Finish and Sealant Products
121,Brand New Family Entertainment Center
168,Brand New Authentic Sales and Service
199,Brand New Friendly Neighborhood Bikes
206,Brand New Small Bike Accessories Shop
211,Brand New Tachometers and Accessories
242,Brand New Valley Bicycle Distributors
245,Brand New Metropolitan Bicycle Supply
272,Brand New Valuable Bike Parts Company
292,Brand New Cycle Parts and Accessories
51,Brand New Exceptional Cycle Services
67,Brand New Separate Parts Corporation
87,Brand New Acceptable Sales & Service
197,Brand New Remote Bicycle Specialists
207,Brand New List Price Catalog Company
214,Brand New Metropolitan Manufacturing
233,Brand New Strong Metal Manufacturing
247,Brand New Designer Department Stores
252,Brand New Bicycle Lines Distributors
56,Brand New Bikes for Kids and Adults
78,Brand New Capable Sales and Service
81,Brand New Road Way Sales and Rental
107,Brand New Refined Department Stores
143,Brand New Eastside Department Store
174,Brand New Oils and Fluids Warehouse
208,Brand New Seats and Saddles Company
230,Brand New Fitness Department Stores
232,Brand New Eastward Bike Accessories
308,Brand New Permanent Finish Products
50,Brand New Certified Bicycle Supply
104,Brand New Scooters and Bikes Store
108,Brand New Reasonable Bicycle Sales
119,Brand New Gear-Shift Bikes Limited
157,Brand New Tandem Sales and Service
165,Brand New Impervious Paint Company
177,Brand New Rally Master Company Inc
182,Brand New Bike Dealers Association
218,Brand New Rural Mountain Bike Mart
236,Brand New Executive Discount Store
241,Brand New Extraordinary Bike Works
244,Brand New Racing Sales and Service
266,Brand New Trendy Department Stores
293,Brand New Fasteners & Bolts Outlet
302,Brand New Ultimate Bicycle Company
46,Brand New Major Amusement Company
49,Brand New A Great Bicycle Company
144,Brand New Sports Sales and Rental
198,Brand New Curbside Sporting Goods
212,Brand New Cycles Sales and Repair
220,Brand New Engineered Bike Systems
256,Brand New Gears and Parts Company
283,Brand New Timely Shipping Service
287,Brand New Quick Parts and Service
289,Brand New Thrifty Parts and Sales
319,Brand New Totes & Baskets Company
55,Brand New West Wind Distributors
65,Brand New Purple Bicycle Company
71,Brand New Non-Slip Pedal Company
76,Brand New Noiseless Gear Company
94,Brand New Consolidated Messenger
103,Brand New Specialty Sports Store
106,Brand New Roadway Bicycle Supply
130,Brand New Unified Sports Company
131,Brand New National Manufacturing
137,Brand New Metro Sports Equipment
142,Brand New Chic Department Stores
149,Brand New Healthy Activity Store
154,Brand New Leading Sales & Repair
159,Brand New Reliable Retail Center
162,Brand New Yellow Bicycle Company
180,Brand New Exclusive Bicycle Mart
215,Brand New Orange Bicycle Company
267,Brand New Vintage Sport Boutique
288,Brand New Reliable Brake Systems
294,Brand New Functional Store North
301,Brand New Wire Baskets and Parts
304,Brand New Metropolitan Equipment
45,Brand New Express Bike Services
61,Brand New Extras Sporting Goods
66,Brand New New and Used Bicycles
80,Brand New Pretty Bikes and Toys
88,Brand New Brown Bicycle Company
105,Brand New Closest Bicycle Store
109,Brand New Out-of-the-Way Hotels
110,Brand New Outdoor Sports Supply
138,Brand New Nearby Sporting Goods
155,Brand New Main Bicycle Services
163,Brand New Sports Products Store
164,Brand New Selected Distributors
178,Brand New Professional Cyclists
179,Brand New Sports Products Store
183,Brand New Pedal Systems Company
185,Brand New Global Bike Retailers
226,Brand New Black Bicycle Company
246,Brand New Honest Repair Service
255,Brand New Plastic Parts Company
262,Brand New Immediate Repair Shop
263,Brand New Off-Price Bike Center
291,Brand New Active Transport Inc.
321,Brand New A Bicycle Association
58,Brand New Home Town Bike Store
79,Brand New Little Sports Center
102,Brand New Mountain Bike Center
113,Brand New Metal Clearing House
133,Brand New Wheelsets Storehouse
139,Brand New Front Sporting Goods
146,Brand New Global Sports Outlet
166,Brand New Shipping Specialists
167,Brand New Finer Sporting Goods
190,Brand New Leather Seat Factory
202,Brand New Recommended Bicycles
217,Brand New Essential Bike Works
235,Brand New Major Sporting Goods
257,Brand New Executive Gift Store
277,Brand New Rural Bicycle Supply
280,Brand New Educational Services
313,Brand New Great Bicycle Supply
52,Brand New Instant Cycle Store
63,Brand New Eleventh Bike Store
69,"Brand New Fabrikam Inc., West"
72,Brand New Variety Bike Outlet
74,"Brand New Fabrikam Inc., East"
123,Brand New Trailblazing Sports
126,Brand New Exhibition Showroom
132,Brand New Volume Bike Sellers
169,Brand New Official Parts Shop
175,Brand New Finished Parts Shop
184,"Brand New Health Spa, Limited"
189,Brand New Spoke Manufacturers
194,Brand New Some Discount Store
196,Brand New Accessories Network
205,Brand New Cycles and Scooters
250,Brand New Region Bike Company
251,Brand New Grown-up Bike Store
259,Brand New Budget Bike Company
261,Brand New Demand Distributors
264,Brand New Red Bicycle Company
276,Brand New Regional Cycle Shop
290,Brand New A Typical Bike Shop
297,Brand New Classic Cycle Store
300,Brand New Recreation Supplies
311,Brand New Exhilarating Cycles
53,Brand New Leisure Activities
57,Brand New Consolidated Sales
68,Brand New Basic Bike Company
73,Brand New Weekend Bike Tours
93,Brand New Twelfth Bike Store
115,Brand New Largest Bike Store
161,Brand New Friendly Bike Shop
176,Brand New Consumer Equipment
181,Brand New City Manufacturing
191,Brand New Good Bicycle Store
234,Brand New Gift and Toy Store
254,Brand New Racing Association
295,Brand New Quantity Discounts
60,Brand New Sample Bike Store
64,Brand New Enterprise Center
101,Brand New Up-To-Date Sports
153,Brand New Larger Cycle Shop
160,Brand New Liquidation Sales
187,Brand New Closeout Boutique
203,Brand New Sunny Place Bikes
216,Brand New Riding Associates
223,Brand New Hiatus Bike Tours
228,Brand New Sellers of Cycles
243,Brand New Top Sports Supply
260,Brand New Eighth Bike Store
282,Brand New Simple Bike Parts
309,Brand New Mercantile Outlet
314,Brand New Mail-Order Outlet
315,Brand New Nearby Cycle Shop
75,Brand New General Supplies
90,Brand New Fitness Supplies
96,Brand New Field Trip Store
98,Brand New Finer Parts Shop
100,Brand New Next Door Cycles
114,Brand New Many Bikes Store
120,Brand New Frugal Bike Shop
128,Brand New Two-Seater Bikes
151,Brand New Grand Industries
152,Brand New Ideal Components
201,Brand New Preferable Bikes
204,Brand New Alpine Ski House
213,Brand New Low Price Cycles
222,Brand New One Bike Company
231,Brand New Famous Bike Shop
271,Brand New Tenth Bike Store
281,Brand New Active Life Toys
307,Brand New Solid Bike Parts
92,Brand New Spare Parts Co.
124,Brand New Racing Partners
134,Brand New Town Industries
145,Brand New Cycle Merchants
150,Brand New Every Bike Shop
156,Brand New Metro Bike Mart
158,Brand New Sensible Sports
192,Brand New Endurance Bikes
195,Brand New Variety Cycling
225,Brand New Cycle Clearance
227,Brand New Transport Bikes
249,Brand New Top Bike Market
270,Brand New The Bike Outlet
279,Brand New The Cycle Store
299,Brand New Large Bike Shop
312,Brand New Exercise Center
171,Brand New Discount Tours
210,Brand New All Cycle Shop
258,Brand New Big Cycle Mall
269,Brand New West Side Mart
273,Brand New Fun Times Club
305,Brand New Extended Tours
320,Brand New World of Bikes
59,Brand New Optimal Bikes
89,Brand New District Mall
141,Brand New Catalog Store
148,Brand New Fitness Hotel
170,"Brand New Contoso, Ltd."
172,Brand New Tire Exchange
209,Brand New Village Tours
224,Brand New Cycling Goods
237,Brand New Major Cycling
248,Brand New Wheel Gallery
268,Brand New Travel Sports
275,Brand New Mobile Outlet
86,Brand New Township Inn
95,Brand New Daring Rides
99,Brand New Glossy Bikes
125,Brand New Perfect Toys
147,Brand New Exotic Bikes
173,Brand New Racing Tours
219,Brand New City Cycling
240,Brand New Bike Experts
278,Brand New Wingtip Toys
284,Brand New A Cycle Shop
286,Brand New Fitness Toys
296,Brand New Swift Cycles
303,Brand New Sports Store
77,Brand New Racing Toys
82,Brand New Sturdy Toys
91,Brand New Mail Market
129,Brand New More Bikes!
136,Brand New Rapid Bikes
140,Brand New Elite Bikes
238,Brand New Getaway Inn
310,Brand New Links Works
317,Brand New Retreat Inn
84,Brand New Fad Outlet
